Citation,Author,Tags,Page
We should consider every day lost on which we have not danced at least once.,Friedrich Wilhelm Nietzsche,"dance, dancing, music",47
Imagine smiling after a slap in the face. Then think of doing it twenty-four hours a day.,"Markus Zusak,","pain, sadness, stoicism",47
I cannot believe in a God who wants to be praised all the time.,Friedrich Nietzsche,"agama, agnosticism, prayer, religion",47
"The world breaks everyone, and afterward, many are strong at the broken places.",Ernest Hemingway,,47
"Letting go means to come to the realization that some people are a part of your history, but not a part of your destiny.",Steve Maraboli,"destiny, happiness, history, inspirational, let-go, letting-go, life, motivational, moving-on, success",47
The world was hers for the reading.,"Betty Smith,","books, feminist, reading",47
I dream. Sometimes I think that's the only right thing to do.,"Haruki Murakami,","dreaming, dreams",47
"Suffering has been stronger than all other teaching, and has taught me to understand what your heart used to be. I have been bent and broken, but - I hope - into a better shape.","Charles Dickens,","growth, heart, life, suffering",47
Many a book is like a key to unknown chambers within the castle of one’s own self.,Franz Kafka,"books, castle, self",47
Atticus told me to delete the adjectives and I'd have the facts.,"Harper Lee,",writing-advice,47
Life appears to me too short to be spent in nursing animosity or registering wrongs.,"Charlotte Bronte,",grudges,47
It is a great thing to start life with a small number of really good books which are your very own.,Arthur Conan Doyle,"books, humor",47
"They say when you are missing someone that they are probably feeling the same, but I don't think it's possible for you to miss me as much as I'm missing you right now",Edna St. Vincent Millay,,47
It's been my experience that you can nearly always enjoy things if you make up your mind firmly that you will.,"Lucy Maud Montgomery,",happiness,47
"Understanding is the first step to acceptance, and only with acceptance can there be recovery.","J.K. Rowling,","acceptance, inspiration, inspirational, smart, understanding, wise",47
"Isn't it odd how much fatter a book gets when you've read it several times?"" Mo had said...""As if something were left between the pages every time you read it. Feelings, thoughts, sounds, smells...and then, when you look at the book again many years later, you find yourself there, too, a slightly younger self, slightly different, as if the book had preserved you like a pressed flower...both strange and familiar.","Cornelia Funke,","books, feelings, reading, thoughts",47
"If you ever find yourself in the wrong story, leave.","Mo Willems,","fairy-tales, humor, humorous, philosophy, psychology",47
You is kind. You is smart. You is important.,"Kathryn Stockett,",,47
"No, I'm just a very naughty boy. I do all sorts of bad things. I kick kittens. I make rude gestures at nuns.","Cassandra Clare,",,47
Do your thing and don't care if they like it.,"Tina Fey,",,47
Never be afraid to trust an unknown future to a known God.,Corrie ten Boom,"faith, future, god, trust",47
It is not that I'm so smart. But I stay with the questions much longer.,Albert Einstein,"intelligence, learning, wisdom",47
"It's not the face, but the expressions on it. It's not the voice, but what you say. It's not how you look in that body, but the thing you do with it. You are beautiful.","Stephenie Meyer,","inspirational, love",47
"Both Rowling and Meyer, they’re speaking directly to young people. … The real difference is that Jo Rowling is a terrific writer and Stephenie Meyer can’t write worth a darn. She’s not very good.",Stephen King,"harry-potter, jk-rowling, stephenie-meyer, twilight",47
"Goodbye,"" said the fox. ""And now here is my secret, a very simple secret: It is only with the heart that one can see rightly; what is essential is invisible to the eye.",Antoine de Saint-Exupéry,most-famous-novella,47
"He stepped down, trying not to look long at her, as if she were the sun, yet he saw her, like the sun, even without looking.","Leo Tolstoy,",romantic,47
"The beginning of love is the will to let those we love be perfectly themselves, the resolution not to twist them to fit our own image. If in loving them we do not love what they are, but only their potential likeness to ourselves, then we do not love them: we only love the reflection of ourselves we find in them","Thomas Merton,","friendship, love, self-discovery, trust, truth",48
You never know what worse luck your bad luck has saved you from.,"Cormac McCarthy,",,48
"We waste time looking for the perfect lover, instead of creating the perfect love.",Tom Robbins,,48
"Tonight I can write the saddest linesI loved her, and sometimes she loved me too.","Pablo Neruda,","love, sadness",48
"Words are easy, like the wind; faithful friends are hard to find.","William Shakespeare,",friendship,48
"It doesn't interest me what you do for a living. I want to know what you ache for, and if you dare to dream of meeting your heart's longing.It doesn't interest me how old you are. I want to know if you will risk looking like a fool for love, for your dream, for the adventure of being alive. It doesn't interest me what planets are squaring your moon. I want to know if you have touched the center of your own sorrow, if you have been opened by life's betrayals or have become shriveled and closed from fear of further pain!I want to know if you can sit with pain, mine or your own, without moving to hide it or fade it, or fix it. I want to know if you can be with joy, mine or your own, if you can dance with wildness and let the ecstasy fill you to the tips of your fingers and toes without cautioning us to be careful, to be realistic, to remember the limitations of being human. It doesn't interest me if the story you are telling me is true. I want to know if you can disappoint another to be true to yourself; if you can bear the accusation of betrayal and not betray your own soul; if you can be faithlessand therefore trustworthy. I want to know if you can see beauty even when it's not pretty, every day,and if you can source your own life from its presence. I want to know if you can live with failure, yours and mine, and still stand on the edge of the lake and shout to the silver of the full moon, Yes!It doesn't interest me to know where you live or how much money you have. I want to know if you can get up, after the night of grief and despair, weary and bruised to the bone, and do what needs to be done to feed the children. It doesn't interest me who you know or how you came to be here. I want to know if you will stand in the center of the fire with me and not shrink back. It doesn't interest me where or what or with whom you have studied. I want to know what sustains you, from the inside, when all else falls away. I want to know if you can be alone with yourself and if you truly like the company you keep in the empty moments.",Oriah Mountain Dreamer,inspirational,48
"You here to finish me off, Sweetheart?","Suzanne Collins,","humor, hunger-games, katniss, mellark, peeta, romance",48
The bravest people are the ones who don’t mind looking like cowards.,"T.H. White,",,48
"A cynic is a man who knows the price of everything, and the value of nothing.",Oscar Wilde,cynicism,48
Never lose hope. Storms make people stronger and never last forever.,"Roy T. Bennett,","adversity, difficulty, hope, inspiration, inspirational, inspirational-attitude, inspirational-life, inspirational-quotes, inspire, inspiring, life, life-and-living, life-lessons, life-quotes, living, motivation, motivational, optimism, optimistic, perseverance, persistence, positive, positive-affirmation, positive-life, positive-thinking, storms",48
Don't waste your time with explanations: people only hear what they want to hear.,Paulo Coelho,"attitude, explain, gossip, life, people, public-opinion, time, wisdom",48
Perhaps it's impossible to wear an identity without becoming what you pretend to be.,"Orson Scott Card,","identity, pretend",48
"You might be poor, your shoes might be broken, but your mind is a palace.","Frank McCourt,","intelligence, mind, poverty",48
It is forbidden to kill; therefore all murderers are punished unless they kill in large numbers and to the sound of trumpets.,Voltaire,"double-standards, ethics, governments, humor, irony, killing, law, mankind, morality, murder, nationalism, nations, war",48
"Live in the sunshine, swim the sea, drink the wild air.",Ralph Waldo Emerson,,48
"I never change, I simply become more myself.","Joyce Carol Oates,",,48
"I was thinking about the first time I ever saw you,"" he said, ""and how after that I couldn't forget you. I wanted to, but I couldn't stop myself. I forced Hodge to let me be the one who came to find you and bring you back to the Institue. And even back then, in that stupid coffee shop, when I saw you sitting on that couch with Simon, even then that felt wrong to me-- I should have been the one sitting with you. The one who made you laugh like that. I couldn't get rid of that feeling. That it should have been me. And the more I knew you, the more I felt it--it had never been like that for me before. I'd always wanted a girl and then gotten to know her and not wanted her anymore, but with you the feeling just got stronger and stronger until that night when you showed up at Renwick's and I knew.","Cassandra Clare,","mortal-instruments, teen-fantasy",48
There is not always a good guy. Nor is there always a bad one. Most people are somewhere in between.,"Patrick Ness,",,48
"It happens to everyone as they grow up. You find out who you are and what you want, and then you realize that people you've known forever don't see things the way you do. So you keep the wonderful memories, but find yourself moving on.",Nicholas Sparks,moving-on,48
"Happiness is the consequence of personal effort. You fight for it, strive for it, insist upon it, and sometimes even travel around the world looking for it. You have to participate relentlessly in the manifestations of your own blessings. And once you have achieved a state of happiness, you must never become lax about maintaining it. You must make a mighty effort to keep swimming upward into that happiness forever, to stay afloat on top of it.","Elizabeth Gilbert,",happiness,48
"Today a reader, tomorrow a leader.",Margaret Fuller,"read, reader, reading",48
"I wasn't actually in love, but I felt a sort of tender curiosity.","F. Scott Fitzgerald,","affection, amity, love",48
"It's not because I want to make out with her.""Hold on."" He grabbed a pencil and scrawled excitedly at the paper as if he'd just made a mathematical breakthrough and then looked back up at me. ""I just did some calculations, and I've been able to determine that you're full of shit","John Green,",funny,48
Youth is happy because it has the capacity to see beauty. Anyone who keeps the ability to see beauty never grows old.,Franz Kafka,"beauty, wonder, young-at-heart, youth, youthfulness",48
I'm sure the universe is full of intelligent life. It's just been too intelligent to come here.,Arthur C. Clarke,"extraterrestrials, humor, intelligent-life, life, science, universe",48
Gravitation is not responsible for people falling in love.,Albert Einstein,love,48
"At some point, you just pull off the Band-Aid, and it hurts, but then it's over and you're relieved.","John Green,",looking-for-alaska,48
"Great things happen to those who don't stop believing, trying, learning, and being grateful.","Roy T. Bennett,","being-positive, believe, gratitude, inspiration, inspirational, inspirational-quotes, life, life-quotes, live, motivation, never-stop-believing, never-stop-learning, optimism, optimistic, positive, positive-affirmation, positive-life, positive-thinking, try, trying",48
"Don't be afraid of death; be afraid of an unlived life. You don't have to live forever, you just have to live.","Natalie Babbitt,",life,48
"He smiled understandingly-much more than understandingly. It was one of those rare smiles with a quality of eternal reassurance in it, that you may come across four or five times in life. It faced--or seemed to face--the whole eternal world for an instant, and then concentrated on you with an irresistible prejudice in your favor. It understood you just as far as you wanted to be understood, believed in you as you would like to believe in yourself, and assured you that it had precisely the impression of you that, at your best, you hoped to convey.","F. Scott Fitzgerald,",smiling,48
Time is an illusion. Lunchtime doubly so.,"Douglas Adams,","humor, philosophy, science-fiction",49
The reasonable man adapts himself to the world: the unreasonable one persists in trying to adapt the world to himself. Therefore all progress depends on the unreasonable man.,"George Bernard Shaw,","life, philosophy, philosophy-of-life, progress",49
You don't remember what happened. What you remember becomes what happened.,"John Green,","an-abundance-of-katherines, joh-green, nerdfighters",49
"Sometimes it seems safer to hold it all in, where the only person who can judge is yourself.",Sarah Dessen,,49
All we demanded was our right to twinkle.,Marilyn Monroe,,49
Wherever you go becomes a part of you somehow.,Anita Desai,travel,49
"Is standing by the window muttering about blood something he does all the time?"" asked Simon.""No,"" Jace said. ""Sometimes he sits on the couch and does it.","Cassandra Clare,",,49
The past has no power over the present moment.,Eckhart Tolle,"education, inspirational, life, philosophy, truth, wisdom",49
"Don't part with your illusions. When they are gone you may still exist, but you have ceased to live.",Mark Twain,"illusions, life",49
"You need to learn how to select your thoughts just the same way you select your clothes every day. This is a power you can cultivate. If you want to control things in your life so bad, work on the mind. That's the only thing you should be trying to control.","Elizabeth Gilbert,","eat-pray-love, elizabeth-gilbert, inspiration",49
"Grover was sniffing the wind, looking nervous. He fished out his acorns and threw them into the sand, then played his pipes. They rearranged themselves in a pattern that made no sense to me, but Grover looked concerned. ""That's us,"" he said. ""Those five nuts right there."" ""Which one is me?"" I asked. ""The little deformed one,"" Zoe suggested. ""Oh, shut up.","Rick Riordan,","acorns, percy-jackson, zoe-nightshade",49
Don't feel sorry for yourself. Only assholes do that.,"Haruki Murakami,",nagasawa,49
"Everything we hear is an opinion, not a fact. Everything we see is a perspective, not the truth.","Marcus Aurelius ,",truth,49
"If a book about failures doesn't sell, is it a success?",Jerry Seinfeld,"books, funny",49
"There are three types of lies -- lies, damn lies, and statistics.",Benjamin Disraeli,"attributed-no-source, lies, lying, misattributed-mark-twain, statistics, truth",49
"The very least you can do in your life is figure out what you hope for. And the most you can do is live inside that hope. Not admire it from a distance but live right in it, under its roof.","Barbara Kingsolver,",hope,49
"Maybe you can afford to wait. Maybe for you there's a tomorrow. Maybe for you there's one thousand tomorrows, or three thousand, or ten, so much time you can bathe in it, roll around it, let it slide like coins through you fingers. So much time you can waste it.But for some of us there's only today. And the truth is, you never really know.","Lauren Oliver,",inspirational-life,49
"Despite my ghoulish reputation, I really have the heart of a small boy. I keep it in a jar on my desk.",Robert Bloch,,49
"Someday, somewhere - anywhere, unfailingly, you'll find yourself, and that, and only that, can be the happiest or bitterest hour of your life.",Pablo Neruda,,49
I am made of memories.,"Madeline Miller,",,49
"You will lose someone you can’t live without,and your heart will be badly broken, and the bad news is that you never completely get over the loss of your beloved. But this is also the good news. They live forever in your broken heart that doesn’t seal back up. And you come through. It’s like having a broken leg that never heals perfectly—that still hurts when the weather gets cold, but you learn to dance with the limp.",Anne Lamott,"grief, loss, recovery",49
"Isabelle drifted over, Jace a pace behind her. She was wearing a long black dress with boots and an even longer cutaway coat of soft green velvet, the color of moss. ""I can't believe you did it!"" she exclaimed. ""How did you get Magnus to let Jace leave?""""Traded him for Alec,"" Clary said.Isabelle looked mildly alarmed. ""Not permanently?""""No,"" said Jace. ""Just for a few hours. Unless I don't come back,"" he added thoughtfully. ""In which case, maybe he does get to keep Alec. Think of it as a lease with an option to buy.""Isabelle looked dubious. ""Mom and Dad won't be pleased if they find out.""""That you freed a possible criminal by trading away your brother to a warlock who looks like a gay Sonic the Hedgehog and dresses like the Child Catcher from Chitty Chitty Bang Bang?"" Simon inquired. ""No, probably not.","Cassandra Clare,","alec-lightwood, clary-fray, humor, isabelle-lightwood, jace-wayland, simon-lewis",49
Do not fear failure but rather fear not trying.,"Roy T. Bennett,","failure, fearless, inspiration, inspirational, inspirational-attitude, inspirational-life, inspirational-quote, inspirational-quotes, inspire, inspiring, life, life-and-living, life-lessons, life-philosophy, life-quotes, living, motivation, motivational, never-give-up, optimism, optimistic, persistence, positive, positive-affirmation, positive-life, positive-thinking, trying",49
"I crave your mouth, your voice, your hair.Silent and starving, I prowl through the streets. Bread does not nourish me, dawn disrupts me, all day I hunt for the liquid measure of your steps. I hunger for your sleek laugh, your hands the color of a savage harvest, hunger for the pale stones of your fingernails, I want to eat your skin like a whole almond. I want to eat the sunbeam flaring in your lovely body, the sovereign nose of your arrogant face, I want to eat the fleeting shade of your lashes, and I pace around hungry, sniffing the twilight, hunting for you, for your hot heart, Like a puma in the barrens of Quitratue.",Pablo Neruda,"love, poetry",49
"Knock, And He'll open the doorVanish, And He'll make you shine like the sunFall, And He'll raise you to the heavensBecome nothing, And He'll turn you into everything.",Jalal Ad-Din Rumi,"islam, religion, spirituality",49
"Hello babies. Welcome to Earth. It's hot in the summer and cold in the winter. It's round and wet and crowded. On the outside, babies, you've got a hundred years here. There's only one rule that I know of, babies-""God damn it, you've got to be kind.",Kurt Vonnegut,fact,49
What you do speaks so loudly that I cannot hear what you say.,Ralph Waldo Emerson,,49
"Words are pale shadows of forgotten names. As names have power, words have power. Words can light fires in the minds of men. Words can wring tears from the hardest hearts.","Patrick Rothfuss,","description, language, power-of-words, words",49
"Whatever the cost of our libraries, the price is cheap compared to that of an ignorant nation.",Walter Cronkite,"education, ignorance, intelligence, libraries",49
"Don't you think it's better to be extremely happy for a short while, even if you lose it, than to be just okay for your whole life?","Audrey Niffenegger,",life,49
"Travel is fatal to prejudice, bigotry, and narrow-mindedness, and many of our people need it sorely on these accounts. Broad, wholesome, charitable views of men and things cannot be acquired by vegetating in one little corner of the earth all one's lifetime.","Mark Twain,",travel,50
‎Though nobody can go back and make a new beginning... Anyone can start over and make a new ending.,Chico Xavier,"inspirational, life-lessons",50
Look after my heart - I've left it with you.,"Stephenie Meyer,","bella, edward, love, twilight-saga",50
I cannot teach anybody anything. I can only make them think,Socrates,"knowledge, philosophy",50
"It’s probably not just by chance that I’m alone. It would be very hard for a man to live with me, unless he’s terribly strong. And if he’s stronger than I, I’m the one who can’t live with him. … I’m neither smart nor stupid, but I don’t think I’m a run-of-the-mill person. I’ve been in business without being a businesswoman, I’ve loved without being a woman made only for love. The two men I’ve loved, I think, will remember me, on earth or in heaven, because men always remember a woman who caused them concern and uneasiness. I’ve done my best, in regard to people and to life, without precepts, but with a taste for justice.",Coco Chanel,"autonomy, bachelorhood, empowerment, freedom, independence, individuality, love, marriage, matrimony, men, self-determination, self-sufficiency, singles, strength, women",50
"Fall down again, Bella?'No, Emmett, I punched a werewolf in the face.","Stephenie Meyer,",,50
"Behind every exquisite thing that existed, there was something tragic.","Oscar Wilde,","aesthetics, appreciation, hidden-things",50
"Sometimes, you read a book and it fills you with this weird evangelical zeal, and you become convinced that the shattered world will never be put back together unless and until all living humans read the book. And then there are books like An Imperial Affliction, which you can't tell people about, books so special and rare and yours that advertising your affection feels like betrayal","John Green,","books, john-green, reading, the-fault-in-our-stars",50
"I nodded, looking at Rachel with respect. ""You hit the Lord of the Titans in the eye with a blue plastic hairbrush.",Rick Riordan,"percy-jackson, rachel-elizabeth-dare",50
"You know, when it works, love is pretty amazing. It's not overrated. There's a reason for all those songs.","Sarah Dessen,",love,50
Men are afraid that women will laugh at them. Women are afraid that men will kill them.,Margaret Atwood,"apocryphal, feminism",50
Let us learn to show our friendship for a man when he is alive and not after he is dead.,"F. Scott Fitzgerald,",,50
"You won’t understand what I mean now, but someday you will: the only trick of friendship, I think, is to find people who are better than you are—not smarter, not cooler, but kinder, and more generous, and more forgiving—and then to appreciate them for what they can teach you, and to try to listen to them when they tell you something about yourself, no matter how bad—or good—it might be, and to trust them, which is the hardest thing of all. But the best, as well.","Hanya Yanagihara,",,50
"When he died, all things soft and beautiful and bright would be buried with him.","Madeline Miller,","death, death-of-a-loved-one, love",50
Growing apart doesn't change the fact that for a long time we grew side by side; our roots will always be tangled. I'm glad for that.,"Ally Condie,","childhood, friendship, growing-up",50
To say goodbye is to die a little.,"Raymond Chandler,","change, life, parting, romantics",50
"When I discover who I am, I’ll be free.","Ralph Ellison,","freedom, identity, independence, self-awareness, self-discovery",50
"Success is getting what you want, happiness is wanting what you get",W.P. Kinsella,"happiness, success",50
"You see things; you say, 'Why?' But I dream things that never were; and I say 'Why not?","George Bernard Shaw,",inspirational,50
"Oh well... I'd just been thinking, if you had died, you'd have been welcome to share my toilet.","J.K. Rowling,","flirting, humor",50
We are just an advanced breed of monkeys on a minor planet of a very average star. But we can understand the Universe. That makes us something very special.,Stephen Hawking,"inspirational, science",50
We must be willing to let go of the life we planned so as to have the life that is waiting for us.,Joseph Campbell,"change, life, open-heart, open-mind, resilience",50
Everyone you will ever meet knows something you don't.,Bill  Nye,,50
"And when at last you find someone to whom you feel you can pour out your soul, you stop in shock at the words you utter— they are so rusty, so ugly, so meaningless and feeble from being kept in the small cramped dark inside you so long.","Sylvia Plath,","confidences, secrets, sharing-secrets",50
