Citation,Author,Tags,Page
"We are all different. Don’t judge, understand instead.","Roy T. Bennett,","authentic-living, authentic-self, authenticity, compassion",22
"I am a man"" he told her, ""and men do not consume pink beverages. Get thee gone woman, and bring me something brown.","Cassandra Clare,","brown, city-of-glass, clare, isabelle, jace",22
It is not in the stars to hold our destiny but in ourselves.,William Shakespeare,destiny,22
Reader's Bill of Rights1. The right to not read 2. The right to skip pages 3. The right to not finish 4. The right to reread 5. The right to read anything 6. The right to escapism 7. The right to read anywhere 8. The right to browse 9. The right to read out loud 10. The right to not defend your tastes,Daniel Pennac,"books, reading, rights",22
Good books don't give up all their secrets at once.,Stephen King,books,22
"Believe in yourself. You are braver than you think, more talented than you know, and capable of more than you imagine.","Roy T. Bennett,","achievement, believe-in-yourself, brave, courage, inspiration, inspirational, inspirational-attitude, inspirational-life, inspirational-quotes, inspire, inspiring, life, life-and-living, life-lessons, life-quotes, living, motivation, motivational, optimism, optimistic, positive, positive-affirmation, positive-life, positive-thinking, talent",22
"I think if I've learned anything about friendship, it's to hang in, stay connected, fight for them, and let them fight for you. Don't walk away, don't be distracted, don't be too busy or tired, don't take them for granted. Friends are part of the glue that holds life and faith together. Powerful stuff.",Jon Katz,"faith, friends, friendship, love",22
You never have to change anything you got up in the middle of the night to write.,Saul Bellow,"imagination, inspiration, writing",22
"What the hell is that?"" I laughed.""It's my fox hat.""""Your fox hat?""""Yeah, Pudge. My fox hat.""""Why are you wearing your fox hat?"" I asked.""Because no one can catch the motherfucking fox.","John Green,","funny, humor",22
Deserves it! I daresay he does. Many that live deserve death. And some that die deserve life. Can you give it to them? Then do not be too eager to deal out death in judgement. For even the very wise cannot see all ends.,"J.R.R. Tolkien,",,22
I love to see a young girl go out and grab the world by the lapels. Life's a bitch. You've got to go out and kick ass.,maya angelou,"humor, inspirational, life",22
Never allow someone to be your priority while allowing yourself to be their option.,Mark Twain,heartbreak,23
Either write something worth reading or do something worth writing.,Benjamin Franklin,hmmm,23
Accept who you are. Unless you're a serial killer.,"Ellen DeGeneres,",funny,23
"He never went out without a book under his arm, and he often came back with two.","Victor Hugo,",,23
"I was gratified to be able to answer promptly, and I did. I said I didn’t know.",Mark Twain,"humor, knowledge",23
"No one ever told me I was pretty when I was a little girl. All little girls should be told they're pretty, even if they aren't.",Marilyn Monroe,"beauty, girls",23
"Once on a yellow piece of paper with green lines	he wrote a poemAnd he called it ""Chops""	because that was the name of his dogAnd that's what it was all aboutAnd his teacher gave him an A	and a gold starAnd his mother hung it on the kitchen door	and read it to his auntsThat was the year Father Tracy	took all the kids to the zooAnd he let them sing on the busAnd his little sister was born	with tiny toenails and no hairAnd his mother and father kissed a lotAnd the girl around the corner sent him aValentine signed with a row of X's	and he had to ask his father what the X's meantAnd his father always tucked him in bed at nightAnd was always there to do itOnce on a piece of white paper with blue lines	he wrote a poemAnd he called it ""Autumn""	because that was the name of the seasonAnd that's what it was all aboutAnd his teacher gave him an A	and asked him to write more clearlyAnd his mother never hung it on the kitchen door	because of its new paintAnd the kids told him	that Father Tracy smoked cigarsAnd left butts on the pewsAnd sometimes they would burn holesThat was the year his sister got glasses	with thick lenses and black framesAnd the girl around the corner laughed	when he asked her to go see Santa ClausAnd the kids told him why	his mother and father kissed a lotAnd his father never tucked him in bed at nightAnd his father got mad	when he cried for him to do it.Once on a paper torn from his notebook	he wrote a poemAnd he called it ""Innocence: A Question""	because that was the question about his girlAnd that's what it was all aboutAnd his professor gave him an A	and a strange steady lookAnd his mother never hung it on the kitchen door	because he never showed herThat was the year that Father Tracy diedAnd he forgot how the end	of the Apostle's Creed wentAnd he caught his sister	making out on the back porchAnd his mother and father never kissed	or even talkedAnd the girl around the corner	wore too much makeupThat made him cough when he kissed her	but he kissed her anyway	because that was the thing to doAnd at three a.m. he tucked himself into bed	his father snoring soundlyThat's why on the back of a brown paper bag	he tried another poemAnd he called it ""Absolutely Nothing""Because that's what it was really all aboutAnd he gave himself an A	and a slash on each damned wristAnd he hung it on the bathroom door	because this time he didn't think	he could reach the kitchen.","Stephen Chbosky,",poem,23
"Is this the part where you say if I hurt her, you'll kill me?""""No"" Simon said, ""If you hurt Clary she's quite capable of killing you herself. Possibly with a variety of weapons.","Cassandra Clare,","city-of-glass, jace, simon",23
It's not true that I had nothing on. I had the radio on.,Marilyn Monroe,"dirty, funny, logo, sex",23
Stop acting so small. You are the universe in ecstatic motion.,Rumi,,23
Turn your wounds into wisdom.,Oprah Winfrey,"experience, inspirational, pain, wisdom, wounds",23
Two possibilities exist: either we are alone in the Universe or we are not. Both are equally terrifying.,Arthur C. Clarke,"distance, life, loneliness, qotd, sense-of-wonder, universe",23
You must have chaos within you to give birth to a dancing star.,Friedrich Nietzsche,"art, chaos",23
"So please, oh please, we beg, we pray,Go throw your TV set away,And in its place you can installA lovely bookshelf on the wall.Then fill the shelves with lots of books.","Roald Dahl,","books, humor, television",23
"The important thing is not to stop questioning. Curiosity has its own reason for existence. One cannot help but be in awe when he contemplates the mysteries of eternity, of life, of the marvelous structure of reality. It is enough if one tries merely to comprehend a little of this mystery each day.—""Old Man's Advice to Youth: 'Never Lose a Holy Curiosity.'"" LIFE Magazine (2 May 1955) p. 64",Albert Einstein,"1955, curiosity, mystery",23
I'm not saying that everything is survivable. Just that everything except the last thing is.,"John Green,",,23
"Life is too short to waste your time on people who don’t respect, appreciate, and value you.","Roy T. Bennett,","appreciate, inspiration, inspirational, inspirational-attitude",23
"Kiss me, and you will see how important I am.","Sylvia Plath,","importance, kiss, kissing",23
"No tears in the writer, no tears in the reader. No surprise in the writer, no surprise in the reader.",Robert Frost,"reading, writing",23
"My experience of life is that it is not divided up into genres; it’s a horrifying, romantic, tragic, comical, science-fiction cowboy detective novel. You know, with a bit of pornography if you're lucky.",Alan Moore,life,23
"When you have eliminated all which is impossible, then whatever remains, however improbable, must be the truth.","Arthur Conan Doyle,",inspirational,23
"You could have had anything else in the world, and you asked for me.""She smiled up at him. Filthy as he was, covered in blood and dirt, he was the most beautiful thing she'd ever seen.""But I don't want anything else in the world.","Cassandra Clare,","clary-fray, jace-wayland, love",23
"When you're struggling with something, look at all the people around you and realize that every single person you see is struggling with something, and to them, it's just as hard as what you're going through.","Nicholas Sparks,",,23
Nothing that’s worthwhile is ever easy. Remember that.,"Nicholas Sparks,",,23
Books may well be the only true magic.,Alice Hoffman,books,23
"Not my daughter, you bitch!","J.K. Rowling,","anger, molly-weasley-anger",23
Happiness is a warm puppy.,Charles M. Schulz,"animals, dogs, happiness, humor, puppies",23
"Men occasionally stumble over the truth, but most of them pick themselves up and hurry off as if nothing had happened.",Winston S. Churchill,truth,23
"You have your way. I have my way. As for the right way, the correct way, and the only way, it does not exist.",Friedrich Wilhelm Nietzsche,"amorality, correct-way, individuality, my-way, only-way, right-way, the-way, your-way",23
"Painting is poetry that is seen rather than felt, and poetry is painting that is felt rather than seen.",Leonardo da Vinci,,23
I wonder how many people I've looked at all my life and never seen.,"John Steinbeck,",,24
"The simple things are also the most extraordinary things, and only the wise can see them.","Paulo Coelho,",wisdom,24
"It is said that your life flashes before your eyes just before you die. That is true, it's called Life.","Terry Pratchett,","death, humor, life",24
To go wrong in one's own way is better than to go right in someone else's.,"Fyodor Dostoevsky,","independent-thought, self-determination, self-expression",24
"You gain strength, courage and confidence by every experience in which you really stop to look fear in the face. You are able to say to yourself, 'I have lived through this horror. I can take the next thing that comes along.' You must do the thing you think you cannot do.","Eleanor Roosevelt,",confidence,24
Live the Life of Your Dreams: Be brave enough to live the life of your dreams according to your vision and purpose instead of the expectations and opinions of others.,"Roy T. Bennett,","brave, courage, dreams, inspiration, inspirational, inspirational-attitude, inspirational-life, inspirational-quotes, inspire, inspiring, life, life-and-living, life-lessons, life-quotes, living, motivation, motivational, optimism, optimistic, positive, positive-affirmation, positive-life, positive-thinking, purpose, vision",24
"What happens when people open their hearts?""""They get better.","Haruki Murakami,","healing, vulnerability",24
"Religion has actually convinced people that there's an invisible man living in the sky who watches everything you do, every minute of every day. And the invisible man has a special list of ten things he does not want you to do. And if you do any of these ten things, he has a special place, full of fire and smoke and burning and torture and anguish, where he will send you to live and suffer and burn and choke and scream and cry forever and ever 'til the end of time! But He loves you. He loves you, and He needs money! He always needs money! He's all-powerful, all-perfect, all-knowing, and all-wise, somehow just can't handle money!",George Carlin,"atheism, humor, life, religion",24
"Each day means a new twenty-four hours. Each day means everything's possible again. You live in the moment, you die in the moment, you take it all one day at a time.","Marie Lu,",,24
"Everyone sees what you appear to be, few experience what you really are.","Niccolò Machiavelli,",,24
Stories of imagination tend to upset those without one.,Terry Pratchett,"fantasy, humor, imagination, literature, stories",24
"Without pain, how could we know joy?' This is an old argument in the field of thinking about suffering and its stupidity and lack of sophistication could be plumbed for centuries but suffice it to say that the existence of broccoli does not, in any way, affect the taste of chocolate.","John Green,",,24
"You're still trying to protect me. Real or not real,"" he whispers.""Real,"" I answer. ""Because that's what you and I do, protect each other.","Suzanne Collins,","hunger-games, katniss, peeta",24
"Love doesn't just sit there, like a stone, it has to be made, like bread; remade all the time, made new.","Ursula K. Le Guin,",love,24
"You said you were going for a walk!? What kind of walk takes six hours?""""A long one?","Cassandra Clare,",mortal-instruments,24
"Fantasy is a necessary ingredient in living, it's a way of looking at life through the wrong end of a telescope.",Dr. Seuss,,24
To be nobody but yourself in a world which is doing its best day and night to make you like everybody else means to fight the hardest battle which any human being can fight and never stop fighting.,E.E. Cummings,poetry,24
"I am very interested and fascinated how everyone loves each other, but no one really likes each other.","Stephen Chbosky,",moi,24
"Don't ever tell anybody anything. If you do, you start missing everybody.",J. D. Salinger,"salinger, stories",24
"Many people, myself among them, feel better at the mere sight of a book.","Jane Smiley,",,24
"If you have a garden and a library, you have everything you need.",Cicero,books,24
"That is part of the beauty of all literature. You discover that your longings are universal longings, that you're not lonely and isolated from anyone. You belong.",F. Scott Fitzgerald,"belonging, company, desires, literature, longings",24
"The problem with the world is that the intelligent people are full of doubts, while the stupid ones are full of confidence.",Charles Bukowski,,24
You cannot protect yourself from sadness without protecting yourself from happiness.,Jonathan Safran Foer,"happiness, sadness",24
"I don't know the question, but sex is definitely the answer.",Woody Allen,"humor, life, sex",24
Stupid people are dangerous.,"Suzanne Collins,",,24
You have to die a few times before you can reallylive.,"Charles Bukowski,",,24
There comes a time when the world gets quiet and the only thing left is your own heart. So you'd better learn the sound of it. Otherwise you'll never understand what it's saying.,"Sarah Dessen,","just-litsen, sarah-dessen, time",24
"It may be unfair, but what happens in a few days, sometimes even a single day, can change the course of a whole lifetime...","Khaled Hosseini,","fair, life",24
"Above all, be the heroine of your life, not the victim.",Nora Ephron,"courage, empowerment, self-determination, women",24
"Remember when you tried to convince me to feed a poultry pie to the mallards in the park to see if you could breed a race of cannibal ducks?"" ""They ate it too,"" Will reminisced. ""Bloodthirsty little beasts. Never trust a duck.","Cassandra Clare,","jem-carstairs, will-herondale",25
"Imagine yourself as a living house. God comes in to rebuild that house. At first, perhaps, you can understand what He is doing. He is getting the drains right and stopping the leaks in the roof and so on; you knew that those jobs needed doing and so you are not surprised. But presently He starts knocking the house about in a way that hurts abominably and does not seem to make any sense. What on earth is He up to? The explanation is that He is building quite a different house from the one you thought of - throwing out a new wing here, putting on an extra floor there, running up towers, making courtyards. You thought you were being made into a decent little cottage: but He is building a palace. He intends to come and live in it Himself.","C.S. Lewis,",god-religion-house,25
What matters in life is not what happens to you but what you remember and how you remember it.,Gabriel Garcia Marquez,life-memories,25
Deadlines just aren't real to me until I'm staring one in the face.,"Rick Riordan,","deadlines, humor, procrastinate",25
Whatever it is you're seeking won't come in the form you're expecting.,Haruki Marukami,expectation,25
"But luxury has never appealed to me, I like simple things, books, being alone, or with somebody who understands.",Daphne du Maurier,,25
Why fit in when you were born to stand out?,Dr. Seuss,seuss,25
I have great faith in fools - self-confidence my friends will call it.,"Edgar Allan Poe,","faith, fool, humor, self-confidence, self-irony",25
That's the thing about books. They let you travel without moving your feet.,"Jhumpa Lahiri,",,25
I lie to myself all the time. But I never believe me.,"S.E. Hinton,","lies, lying, self-deception, truth",25
"Life is a disease: sexually transmitted, and invariably fatal.",Neil Gaiman,,25
You must stay drunk on writing so reality cannot destroy you.,"Ray Bradbury,",writing,25
"Don’t waste your time in anger, regrets, worries, and grudges. Life is too short to be unhappy.",Roy T. Bennett,"anger, grudge, happiness, happy, inspiration, inspirational, inspirational-quotes, inspire, inspiring, life, life-quotes, living, optimism, optimistic, positive, positive-affirmation, positive-life, positive-thinking, regret, time, worry",25
"People are afraid of themselves, of their own reality; their feelings most of all. People talk about how great love is, but that’s bullshit. Love hurts. Feelings are disturbing. People are taught that pain is evil and dangerous. How can they deal with love if they’re afraid to feel? Pain is meant to wake us up. People try to hide their pain. But they’re wrong. Pain is something to carry, like a radio. You feel your strength in the experience of pain. It’s all in how you carry it. That’s what matters. Pain is a feeling. Your feelings are a part of you. Your own reality. If you feel ashamed of them, and hide them, you’re letting society destroy your reality. You should stand up for your right to feel your pain.",Jim Morrison,"jim, life, morrison, pain, reality",25
"What I need is the dandelion in the spring. The bright yellow that means rebirth instead of destruction. The promise that life can go on, no matter how bad our losses. That it can be good again.","Suzanne Collins,","inspirational, love",25
Prayer is not asking. It is a longing of the soul. It is daily admission of one's weakness. It is better in prayer to have a heart without words than words without a heart.,Mahatma Gandhi,"god, heart, humanity, inspirational, prayer, religion, souls, weakness",25
"One day, in retrospect, the years of struggle will strike you as the most beautiful.",Sigmund Freud,inspirational-quotes,25
"Everyone should be able to do one card trick, tell two jokes, and recite three poems, in case they are ever trapped in an elevator.","Lemony Snicket,",funny,25
There are worse crimes than burning books. One of them is not reading them.,Joseph Brodsky,"books, censorship, illiteracy, reading",25
"Don't JustDon't just learn, experience.Don't just read, absorb.Don't just change, transform.Don't just relate, advocate.Don't just promise, prove.Don't just criticize, encourage.Don't just think, ponder.Don't just take, give.Don't just see, feel.Don’t just dream, do. Don't just hear, listen.Don't just talk, act.Don't just tell, show.Don't just exist, live.","Roy T. Bennett,","act, action, change, criticize, doing, dream, dreams, encouragement, experience, feeling, giving, inspiration, inspirational, inspirational-attitude, inspirational-life, inspirational-quote, inspirational-quotes, inspire, inspiring, learning, life, life-and-living, life-lessons, life-philosophy, life-quotes, listening, living, optimism, optimistic, ponder, positive, positive-affirmation, positive-life, positive-thinking, thinking, transform",25
"I do not fear death. I had been dead for billions and billions of years before I was born, and had not suffered the slightest inconvenience from it.",Mark Twain,"death, inspirational",25
"If you love somebody, let them go, for if they return, they were always yours. If they don't, they never were.",Kahlil Gibran,,25
Remember: the time you feel lonely is the time you most need to be by yourself. Life's cruelest irony.,"Douglas Coupland,","irony, life, loneliness",25
"I think God, in creating man, somewhat overestimated his ability.",Oscar Wilde,"creation, god, humor, man",25
My ambition is handicapped by laziness,"Charles Bukowski,",,25
"It's a dangerous business, Frodo, going out your door. You step onto the road, and if you don't keep your feet, there's no knowing where you might be swept off to.","J.R.R. Tolkien,",,25
"To douchebags!"" he said, gesturing to Brad. ""And to girls that break your heart,"" he bowed his head to me. His eyes lost focus. ""And to the absolute fucking horror of losing your best friend because you were stupid enough to fall in love with her.","Jamie McGuire,","best-friends, heartbreak, love",25
"Kaz leaned back. ""What's the easiest way to steal a man's wallet?""""Knife to the throat?"" asked Inej.""Gun to the back?"" said Jesper.""Poison in his cup?"" suggested Nina.""You're all horrible,"" said Matthias.","Leigh Bardugo,",,25
"Why do you go away? So that you can come back. So that you can see the place you came from with new eyes and extra colors. And the people there see you differently, too. Coming back to where you started is not the same as never leaving.","Terry Pratchett,","adventure, change, discworld, growth, travel",25
"There are three things all wise men fear: the sea in storm, a night with no moon, and the anger of a gentle man.","Patrick Rothfuss,","fear, name-of-the-wind, patrick-rothfuss, wisdom",25
"Yesterday I was clever, so I wanted to change the world. Today I am wise, so I am changing myself.",Rumi,"change, cleverness, misattributed, self, wisdom, world",26
If you're looking for sympathy you'll find it between shit and syphilis in the dictionary.,"David Sedaris,",sympathy,26
"Man may have discovered fire, but women discovered how to play with it.","Candace Bushnell,","love, relationships",26
You cannot swim for new horizons until you have courage to lose sight of the shore.,William Faulkner,"courage, determination, hope, risk",26
I never travel without my diary. One should always have something sensational to read in the train.,"Oscar Wilde,","drama, humor, plays",26
"A WOMAN SHOULD HAVE .... enough money within her control to move out and rent a place of her own even if she never wants to or needs to... A WOMAN SHOULD HAVE .... something perfect to wear if the employer or date of her dreams wants to see her in an hour... A WOMAN SHOULD HAVE ... a youth she's content to leave behind.... A WOMAN SHOULD HAVE .... a past juicy enough that she's looking forward to retelling it in her old age.... A WOMAN SHOULD HAVE ..... a set of screwdrivers, a cordless drill, and a black lace bra... A WOMAN SHOULD HAVE .... one friend who always makes her laugh... and one who lets her cry... A WOMAN SHOULD HAVE .... a good piece of furniture not previously owned by anyone else in her family... A WOMAN SHOULD HAVE .... eight matching plates, wine glasses with stems, and a recipe for a meal that will make her guests feel honored... A WOMAN SHOULD HAVE .... a feeling of control over her destiny... EVERY WOMAN SHOULD KNOW... how to fall in love without losing herself.. EVERY WOMAN SHOULD KNOW... HOW TO QUIT A JOB, BREAK UP WITH A LOVER, AND CONFRONT A FRIEND WITHOUT RUINING THE FRIENDSHIP... EVERY WOMAN SHOULD KNOW... when to try harder... and WHEN TO WALK AWAY... EVERY WOMAN SHOULD KNOW... that she can't change the length of her calves, the width of her hips, or the nature of her parents.. EVERY WOMAN SHOULD KNOW... that her childhood may not have been perfect...but it's over... EVERY WOMAN SHOULD KNOW... what she would and wouldn't do for love or more... EVERY WOMAN SHOULD KNOW... how to live alone... even if she doesn't like it... EVERY WOMAN SHOULD KNOW... whom she can trust, whom she can't, and why she shouldn't take it personally... EVERY WOMAN SHOULD KNOW... where to go... be it to her best friend's kitchen table... or a charming inn in the woods... when her soul needs soothing... EVERY WOMAN SHOULD KNOW... what she can and can't accomplish in a day... a month...and a year...",Pamela Redmond Satran,,26
"But I don’t want to go among mad people,"" Alice remarked.""Oh, you can’t help that,"" said the Cat: ""we’re all mad here. I’m mad. You’re mad.""""How do you know I’m mad?"" said Alice.""You must be,"" said the Cat, ""or you wouldn’t have come here.","Lewis Carroll,",alice-s-adventures-in-wonderland,26
"If you are going through hell, keep going.",Winston S. Churchill,"hell, perseverance",26
"Books are my friends, my companions. They make me laugh and cry and find meaning in life.","Christopher Paolini,","books, christopher-paolini, eragon, good-reads",26
Education is the most powerful weapon which you can use to change the world.,Nelson Mandela,"change, education",26
It isn't what you have or who you are or where you are or what you are doing that makes you happy or unhappy. It is what you think about it.,"Dale Carnegie,","attitude, contentment, happiness, inspirational, life",26
"Some tourists think Amsterdam is a city of sin, but in truth it is a city of freedom. And in freedom, most people find sin.","John Green,","amsterdam, freedom, sin",26
Nothing of me is original. I am the combined effort of everyone I've ever known.,"Chuck Palahniuk,","identity, originality",26
"As usual, there is a great woman behind every idiot.",John Lennon,"beatles, men, women",26
Laughter is timeless. Imagination has no age. And dreams are forever.,Walt Disney,,26
"I have found the paradox, that if you love until it hurts, there can be no more hurt, only more love.","Daphne Rae,",misattributed-to-mother-teresa,26
Angry people are not always wise.,"Jane Austen,","anger, jane-austen, wisdom",26
